{
  "schema": "matrix.qm.capability_registry.v2",
  "registry_id": "matrix-qm-capabilities-v2",
  "manifest_version": "2.1.3",
  "status": "approved",
  "selection_policy": "exact_full_key_fail_closed",
  "allowed_backends": ["xtb", "pyscf", "pyfock", "et", "orca", "psi4"],
  "records": [
    {
      "id": "xtb.gfn2.ground.any.v1",
      "backend": "xtb",
      "method": "GFN2-xTB",
      "basis": "native",
      "electronic_state": "ground",
      "spin": "any",
      "reference": "GFN2-xTB",
      "state_model": "ground",
      "charge_domain": "any_supported_by_backend",
      "multiplicity_domain": "any_supported_by_backend",
      "frozen_core_policy": "not_applicable",
      "ecp_policy": "not_applicable",
      "derivatives": {"energy": "analytic", "gradient": "analytic", "hessian": "analytic"},
      "state_vectors": "none",
      "accelerators": ["none"],
      "platforms": ["macos-arm64", "macos-x86_64", "linux-x86_64"],
      "license_model": "open-source",
      "certification": "certified",
      "production_enabled": true,
      "note": "Established PRE0 and LINK regression capability."
    },
    {
      "id": "pyscf.hf.sto3g.rhf.v1",
      "backend": "pyscf",
      "method": "HF",
      "basis": "STO-3G",
      "electronic_state": "ground",
      "spin": "closed_shell",
      "reference": "RHF",
      "state_model": "ground",
      "charge_domain": "integer",
      "multiplicity_domain": "1",
      "frozen_core_policy": "not_applicable",
      "ecp_policy": "unsupported",
      "derivatives": {"energy": "analytic", "gradient": "analytic", "hessian": "analytic"},
      "state_vectors": "none",
      "accelerators": ["none", "density_fitting"],
      "platforms": ["macos-arm64", "macos-x86_64", "linux-x86_64"],
      "license_model": "open-source",
      "certification": "documented_candidate",
      "production_enabled": false,
      "note": "Canonical L0 closed-shell candidate."
    },
    {
      "id": "pyscf.hf.sto3g.rohf.v1",
      "backend": "pyscf",
      "method": "HF",
      "basis": "STO-3G",
      "electronic_state": "ground",
      "spin": "open_shell",
      "reference": "ROHF",
      "state_model": "ground",
      "charge_domain": "integer",
      "multiplicity_domain": ">=2_high_spin",
      "frozen_core_policy": "not_applicable",
      "ecp_policy": "unsupported",
      "derivatives": {"energy": "analytic", "gradient": "analytic", "hessian": "modal_finite_difference_analytic_gradient"},
      "state_vectors": "none",
      "accelerators": ["none", "density_fitting"],
      "platforms": ["macos-arm64", "macos-x86_64", "linux-x86_64"],
      "license_model": "open-source",
      "certification": "documented_candidate",
      "production_enabled": false,
      "note": "Canonical high-spin L0 ROHF candidate."
    },
    {
      "id": "pyscf.cis.sto3g.rhf.v1",
      "backend": "pyscf",
      "method": "CIS",
      "basis": "STO-3G",
      "electronic_state": "excited",
      "spin": "closed_shell",
      "reference": "RHF",
      "state_model": "TDA-HF",
      "charge_domain": "integer",
      "multiplicity_domain": "1",
      "frozen_core_policy": "not_applicable",
      "ecp_policy": "unsupported",
      "derivatives": {"energy": "analytic", "gradient": "analytic", "hessian": "modal_finite_difference_analytic_gradient"},
      "state_vectors": "transition_density",
      "accelerators": ["none", "density_fitting"],
      "platforms": ["macos-arm64", "macos-x86_64", "linux-x86_64"],
      "license_model": "open-source",
      "certification": "documented_candidate",
      "production_enabled": false,
      "note": "Closed-shell L0 CIS/TDA-HF candidate; strict APOC export required."
    },
    {
      "id": "pyscf.pbe0d3bj.def2svp.rks.v1",
      "backend": "pyscf",
      "method": "PBE0-D3(BJ)-ATM",
      "basis": "def2-SVP",
      "electronic_state": "ground",
      "spin": "closed_shell",
      "reference": "RKS",
      "state_model": "ground",
      "charge_domain": "integer",
      "multiplicity_domain": "1",
      "frozen_core_policy": "not_applicable",
      "ecp_policy": "native",
      "derivatives": {"energy": "composed_analytic", "gradient": "composed_analytic", "hessian": "modal_finite_difference_analytic_gradient"},
      "state_vectors": "none",
      "accelerators": ["none", "density_fitting"],
      "platforms": ["macos-arm64", "macos-x86_64", "linux-x86_64"],
      "license_model": "open-source",
      "certification": "documented_candidate",
      "production_enabled": false,
      "note": "Requires the shared explicit D3(BJ)-ATM energy and gradient."
    },
    {
      "id": "pyscf.pbe0d3bj.def2svp.roks.v1",
      "backend": "pyscf",
      "method": "PBE0-D3(BJ)-ATM",
      "basis": "def2-SVP",
      "electronic_state": "ground",
      "spin": "open_shell",
      "reference": "ROKS",
      "state_model": "ground",
      "charge_domain": "integer",
      "multiplicity_domain": ">=2_high_spin",
      "frozen_core_policy": "not_applicable",
      "ecp_policy": "native",
      "derivatives": {"energy": "composed_analytic", "gradient": "composed_analytic", "hessian": "modal_finite_difference_analytic_gradient"},
      "state_vectors": "none",
      "accelerators": ["none", "density_fitting"],
      "platforms": ["macos-arm64", "macos-x86_64", "linux-x86_64"],
      "license_model": "open-source",
      "certification": "documented_candidate",
      "production_enabled": false,
      "note": "High-spin ROKS semantics and composed D3 gradient require certification."
    },
    {
      "id": "pyscf.tdapbe0d3bj.def2svp.rks.v1",
      "backend": "pyscf",
      "method": "TDA-PBE0-D3(BJ)-ATM",
      "basis": "def2-SVP",
      "electronic_state": "excited",
      "spin": "closed_shell",
      "reference": "RKS",
      "state_model": "TDA",
      "charge_domain": "integer",
      "multiplicity_domain": "1",
      "frozen_core_policy": "not_applicable",
      "ecp_policy": "native",
      "derivatives": {"energy": "composed_analytic", "gradient": "composed_analytic", "hessian": "modal_finite_difference_analytic_gradient"},
      "state_vectors": "transition_density",
      "accelerators": ["none", "density_fitting"],
      "platforms": ["macos-arm64", "macos-x86_64", "linux-x86_64"],
      "license_model": "open-source",
      "certification": "documented_candidate",
      "production_enabled": false,
      "note": "Strict APOC state following and D3 gradient composition required."
    },
    {
      "id": "pyscf.mp2.def2tzvp.rhf.v1",
      "backend": "pyscf",
      "method": "MP2",
      "basis": "def2-TZVP",
      "electronic_state": "ground",
      "spin": "closed_shell",
      "reference": "RHF",
      "state_model": "ground",
      "charge_domain": "integer",
      "multiplicity_domain": "1",
      "frozen_core_policy": "mandatory_supported",
      "ecp_policy": "native",
      "derivatives": {"energy": "analytic", "gradient": "analytic", "hessian": "modal_finite_difference_analytic_gradient"},
      "state_vectors": "none",
      "accelerators": ["none", "density_fitting"],
      "platforms": ["macos-arm64", "macos-x86_64", "linux-x86_64"],
      "license_model": "open-source",
      "certification": "documented_candidate",
      "production_enabled": false,
      "note": "Canonical closed-shell L2 candidate."
    },
    {
      "id": "pyscf.ccsd.def2tzvp.rhf.v1",
      "backend": "pyscf",
      "method": "CCSD",
      "basis": "def2-TZVP",
      "electronic_state": "ground",
      "spin": "closed_shell",
      "reference": "RHF",
      "state_model": "ground",
      "charge_domain": "integer",
      "multiplicity_domain": "1",
      "frozen_core_policy": "mandatory_supported",
      "ecp_policy": "native",
      "derivatives": {"energy": "analytic", "gradient": "analytic", "hessian": "modal_finite_difference_analytic_gradient"},
      "state_vectors": "none",
      "accelerators": ["none", "density_fitting"],
      "platforms": ["macos-arm64", "macos-x86_64", "linux-x86_64"],
      "license_model": "open-source",
      "certification": "documented_candidate",
      "production_enabled": false,
      "note": "Canonical closed-shell L3 ground-state candidate."
    },
    {
      "id": "pyscf.ccsdt.def2tzvpp.rhf.v1",
      "backend": "pyscf",
      "method": "CCSD(T)",
      "basis": "def2-TZVPP",
      "electronic_state": "ground",
      "spin": "closed_shell",
      "reference": "RHF",
      "state_model": "ground",
      "charge_domain": "integer",
      "multiplicity_domain": "1",
      "frozen_core_policy": "mandatory_supported",
      "ecp_policy": "native",
      "derivatives": {"energy": "analytic", "gradient": "analytic", "hessian": "modal_finite_difference_analytic_gradient"},
      "state_vectors": "none",
      "accelerators": ["none"],
      "platforms": ["macos-arm64", "macos-x86_64", "linux-x86_64"],
      "license_model": "open-source",
      "certification": "documented_candidate",
      "production_enabled": false,
      "note": "RCCSD(T) complete analytic-gradient response must be runtime-certified."
    },
    {
      "id": "pyscf.ccsdt.def2tzvpp.uhf.v1",
      "backend": "pyscf",
      "method": "CCSD(T)",
      "basis": "def2-TZVPP",
      "electronic_state": "ground",
      "spin": "open_shell",
      "reference": "stable_UHF_from_L3_ROHF",
      "state_model": "ground",
      "charge_domain": "integer",
      "multiplicity_domain": ">=2_high_spin",
      "frozen_core_policy": "mandatory_supported",
      "ecp_policy": "native",
      "derivatives": {"energy": "analytic", "gradient": "analytic", "hessian": "modal_finite_difference_analytic_gradient"},
      "state_vectors": "none",
      "accelerators": ["none"],
      "platforms": ["macos-arm64", "macos-x86_64", "linux-x86_64"],
      "license_model": "open-source",
      "certification": "documented_candidate",
      "production_enabled": false,
      "note": "Requires the approved ROHF-to-stable-UHF handoff and UCCSD(T) gradient certification."
    },
    {